Subject,Start Date,Start Time,End Date,End Time,All Day Event,Description
游닂 Fundamentos Transversales y Marco Conceptual,2025-06-30,,2025-07-05,,True,Estudio + pr치ctica + avance documentado
游닂 Mantenimiento Electromec치nico Industrial,2025-07-07,,2025-07-12,,True,Estudio + pr치ctica + avance documentado
游닂 Instrumentaci칩n y Control Industrial,2025-07-14,,2025-07-19,,True,Estudio + pr치ctica + avance documentado
游닂 Mecatr칩nica Aplicada,2025-07-21,,2025-07-26,,True,Estudio + pr치ctica + avance documentado
游닂 Software y Hardware Industrial,2025-07-28,,2025-08-02,,True,Estudio + pr치ctica + avance documentado
游닂 IA e Industria 4.0,2025-08-04,,2025-08-09,,True,Estudio + pr치ctica + avance documentado
游닂 Normas T칠cnicas y Gesti칩n Industrial,2025-08-11,,2025-08-16,,True,Estudio + pr치ctica + avance documentado
游닂 Proyecto Final Integrador,2025-08-18,,2025-08-23,,True,Estudio + pr치ctica + avance documentado
